--
-- postgreSql
-- INT4
--
\set ECHO none
\i sql/14.5/int4.sql
--Testcase 111:
CREATE EXTENSION IF NOT EXISTS :DB_EXTENSIONNAME;
--Testcase 112:
CREATE SERVER :DB_SERVERNAME FOREIGN DATA WRAPPER :DB_EXTENSIONNAME OPTIONS(
drivername :DB_DRIVERNAME,
url :DB_URL,
querytimeout '15',
jarfile :DB_DRIVERPATH,
maxheapsize '600'
);
--Testcase 113:
CREATE USER MAPPING FOR public SERVER :DB_SERVERNAME OPTIONS(username :DB_USER,password :DB_PASS);
--Testcase 114:
CREATE FOREIGN TABLE INT4_TBL(id serial OPTIONS (key 'true'), f1 int4) SERVER :DB_SERVERNAME OPTIONS (table_name 'int4_tbl');
--Testcase 115:
CREATE FOREIGN TABLE INT4_TMP(id serial OPTIONS (key 'true'), a int4, b int4) SERVER :DB_SERVERNAME;
DELETE FROM INT4_TBL;
DELETE FROM INT4_TMP;
--Testcase 1:
INSERT INTO INT4_TBL(f1) VALUES ('   0  ');
--Testcase 2:
INSERT INTO INT4_TBL(f1) VALUES ('123456     ');
--Testcase 3:
INSERT INTO INT4_TBL(f1) VALUES ('    -123456');
--Testcase 4:
INSERT INTO INT4_TBL(f1) VALUES ('34.5');
psql:sql/14.5/int4.sql:31: ERROR:  invalid input syntax for type integer: "34.5"
LINE 1: INSERT INTO INT4_TBL(f1) VALUES ('34.5');
                                         ^
-- largest and smallest values
--Testcase 5:
INSERT INTO INT4_TBL(f1) VALUES ('2147483647');
--Testcase 6:
INSERT INTO INT4_TBL(f1) VALUES ('-2147483647');
-- bad input values -- should give errors
--Testcase 7:
INSERT INTO INT4_TBL(f1) VALUES ('1000000000000');
psql:sql/14.5/int4.sql:42: ERROR:  value "1000000000000" is out of range for type integer
LINE 1: INSERT INTO INT4_TBL(f1) VALUES ('1000000000000');
                                         ^
--Testcase 8:
INSERT INTO INT4_TBL(f1) VALUES ('asdf');
psql:sql/14.5/int4.sql:44: ERROR:  invalid input syntax for type integer: "asdf"
LINE 1: INSERT INTO INT4_TBL(f1) VALUES ('asdf');
                                         ^
--Testcase 9:
INSERT INTO INT4_TBL(f1) VALUES ('     ');
psql:sql/14.5/int4.sql:46: ERROR:  invalid input syntax for type integer: "     "
LINE 1: INSERT INTO INT4_TBL(f1) VALUES ('     ');
                                         ^
--Testcase 10:
INSERT INTO INT4_TBL(f1) VALUES ('   asdf   ');
psql:sql/14.5/int4.sql:48: ERROR:  invalid input syntax for type integer: "   asdf   "
LINE 1: INSERT INTO INT4_TBL(f1) VALUES ('   asdf   ');
                                         ^
--Testcase 11:
INSERT INTO INT4_TBL(f1) VALUES ('- 1234');
psql:sql/14.5/int4.sql:50: ERROR:  invalid input syntax for type integer: "- 1234"
LINE 1: INSERT INTO INT4_TBL(f1) VALUES ('- 1234');
                                         ^
--Testcase 12:
INSERT INTO INT4_TBL(f1) VALUES ('123       5');
psql:sql/14.5/int4.sql:52: ERROR:  invalid input syntax for type integer: "123       5"
LINE 1: INSERT INTO INT4_TBL(f1) VALUES ('123       5');
                                         ^
--Testcase 13:
INSERT INTO INT4_TBL(f1) VALUES ('');
psql:sql/14.5/int4.sql:54: ERROR:  invalid input syntax for type integer: ""
LINE 1: INSERT INTO INT4_TBL(f1) VALUES ('');
                                         ^
--Testcase 14:
SELECT f1 FROM INT4_TBL;
     f1      
-------------
           0
      123456
     -123456
  2147483647
 -2147483647
(5 rows)

--Testcase 15:
SELECT i.f1 FROM INT4_TBL i WHERE i.f1 <> int2 '0';
     f1      
-------------
      123456
     -123456
  2147483647
 -2147483647
(4 rows)

--Testcase 16:
SELECT i.f1 FROM INT4_TBL i WHERE i.f1 <> int4 '0';
     f1      
-------------
      123456
     -123456
  2147483647
 -2147483647
(4 rows)

--Testcase 17:
SELECT i.f1 FROM INT4_TBL i WHERE i.f1 = int2 '0';
 f1 
----
  0
(1 row)

--Testcase 18:
SELECT i.f1 FROM INT4_TBL i WHERE i.f1 = int4 '0';
 f1 
----
  0
(1 row)

--Testcase 19:
SELECT i.f1 FROM INT4_TBL i WHERE i.f1 < int2 '0';
     f1      
-------------
     -123456
 -2147483647
(2 rows)

--Testcase 20:
SELECT i.f1 FROM INT4_TBL i WHERE i.f1 < int4 '0';
     f1      
-------------
     -123456
 -2147483647
(2 rows)

--Testcase 21:
SELECT i.f1 FROM INT4_TBL i WHERE i.f1 <= int2 '0';
     f1      
-------------
           0
     -123456
 -2147483647
(3 rows)

--Testcase 22:
SELECT i.f1 FROM INT4_TBL i WHERE i.f1 <= int4 '0';
     f1      
-------------
           0
     -123456
 -2147483647
(3 rows)

--Testcase 23:
SELECT i.f1 FROM INT4_TBL i WHERE i.f1 > int2 '0';
     f1     
------------
     123456
 2147483647
(2 rows)

--Testcase 24:
SELECT i.f1 FROM INT4_TBL i WHERE i.f1 > int4 '0';
     f1     
------------
     123456
 2147483647
(2 rows)

--Testcase 25:
SELECT i.f1 FROM INT4_TBL i WHERE i.f1 >= int2 '0';
     f1     
------------
          0
     123456
 2147483647
(3 rows)

--Testcase 26:
SELECT i.f1 FROM INT4_TBL i WHERE i.f1 >= int4 '0';
     f1     
------------
          0
     123456
 2147483647
(3 rows)

-- positive odds
--Testcase 27:
SELECT i.f1 FROM INT4_TBL i WHERE (i.f1 % int2 '2') = int2 '1';
     f1     
------------
 2147483647
(1 row)

-- any evens
--Testcase 28:
SELECT i.f1 FROM INT4_TBL i WHERE (i.f1 % int4 '2') = int2 '0';
   f1    
---------
       0
  123456
 -123456
(3 rows)

--Testcase 29:
SELECT i.f1, i.f1 * int2 '2' AS x FROM INT4_TBL i;
psql:sql/14.5/int4.sql:105: ERROR:  integer out of range
--Testcase 30:
SELECT i.f1, i.f1 * int2 '2' AS x FROM INT4_TBL i
WHERE abs(f1) < 1073741824;
   f1    |    x    
---------+---------
       0 |       0
  123456 |  246912
 -123456 | -246912
(3 rows)

--Testcase 31:
SELECT i.f1, i.f1 * int4 '2' AS x FROM INT4_TBL i;
psql:sql/14.5/int4.sql:112: ERROR:  integer out of range
--Testcase 32:
SELECT i.f1, i.f1 * int4 '2' AS x FROM INT4_TBL i
WHERE abs(f1) < 1073741824;
   f1    |    x    
---------+---------
       0 |       0
  123456 |  246912
 -123456 | -246912
(3 rows)

--Testcase 33:
SELECT i.f1, i.f1 + int2 '2' AS x FROM INT4_TBL i;
psql:sql/14.5/int4.sql:119: ERROR:  integer out of range
--Testcase 34:
SELECT i.f1, i.f1 + int2 '2' AS x FROM INT4_TBL i
WHERE f1 < 2147483646;
     f1      |      x      
-------------+-------------
           0 |           2
      123456 |      123458
     -123456 |     -123454
 -2147483647 | -2147483645
(4 rows)

--Testcase 35:
SELECT i.f1, i.f1 + int4 '2' AS x FROM INT4_TBL i;
psql:sql/14.5/int4.sql:126: ERROR:  integer out of range
--Testcase 36:
SELECT i.f1, i.f1 + int4 '2' AS x FROM INT4_TBL i
WHERE f1 < 2147483646;
     f1      |      x      
-------------+-------------
           0 |           2
      123456 |      123458
     -123456 |     -123454
 -2147483647 | -2147483645
(4 rows)

--Testcase 37:
SELECT i.f1, i.f1 - int2 '2' AS x FROM INT4_TBL i;
psql:sql/14.5/int4.sql:133: ERROR:  integer out of range
--Testcase 38:
SELECT i.f1, i.f1 - int2 '2' AS x FROM INT4_TBL i
WHERE f1 > -2147483647;
     f1     |     x      
------------+------------
          0 |         -2
     123456 |     123454
    -123456 |    -123458
 2147483647 | 2147483645
(4 rows)

--Testcase 39:
SELECT i.f1, i.f1 - int4 '2' AS x FROM INT4_TBL i;
psql:sql/14.5/int4.sql:140: ERROR:  integer out of range
--Testcase 40:
SELECT i.f1, i.f1 - int4 '2' AS x FROM INT4_TBL i
WHERE f1 > -2147483647;
     f1     |     x      
------------+------------
          0 |         -2
     123456 |     123454
    -123456 |    -123458
 2147483647 | 2147483645
(4 rows)

--Testcase 41:
SELECT i.f1, i.f1 / int2 '2' AS x FROM INT4_TBL i;
     f1      |      x      
-------------+-------------
           0 |           0
      123456 |       61728
     -123456 |      -61728
  2147483647 |  1073741823
 -2147483647 | -1073741823
(5 rows)

--Testcase 42:
SELECT i.f1, i.f1 / int4 '2' AS x FROM INT4_TBL i;
     f1      |      x      
-------------+-------------
           0 |           0
      123456 |       61728
     -123456 |      -61728
  2147483647 |  1073741823
 -2147483647 | -1073741823
(5 rows)

--
-- more complex expressions
--
ALTER FOREIGN TABLE INT4_TBL OPTIONS (SET table_name 'int4_tbl_temp');
-- variations on unary minus parsing
--Testcase 43:
DELETE FROM INT4_TBL;
--Testcase 44:
INSERT INTO INT4_TBL(f1) VALUES (-2);
--Testcase 45:
SELECT (f1+3) as one FROM INT4_TBL;
 one 
-----
   1
(1 row)

--Testcase 46:
DELETE FROM INT4_TBL;
--Testcase 47:
INSERT INTO INT4_TBL(f1) VALUES (4);
--Testcase 48:
SELECT (f1-2) as two FROM INT4_TBL;
 two 
-----
   2
(1 row)

--Testcase 49:
DELETE FROM INT4_TBL;
--Testcase 50:
INSERT INTO INT4_TBL(f1) VALUES (2);
--Testcase 51:
SELECT (f1- -1) as three FROM INT4_TBL;
 three 
-------
     3
(1 row)

--Testcase 52:
DELETE FROM INT4_TBL;
--Testcase 53:
INSERT INTO INT4_TBL(f1) VALUES (2);
--Testcase 54:
SELECT (f1 - -2) as four FROM INT4_TBL;
 four 
------
    4
(1 row)

--Testcase 55:
DELETE FROM INT4_TMP;
--Testcase 56:
INSERT INTO INT4_TMP(a, b) VALUES (int2 '2' * int2 '2', int2 '16' / int2 '4');
--Testcase 57:
SELECT (a = b) as true FROM INT4_TMP;
 true 
------
 t
(1 row)

--Testcase 58:
DELETE FROM INT4_TMP;
--Testcase 59:
INSERT INTO INT4_TMP(a, b) VALUES (int4 '2' * int2 '2', int2 '16' / int4 '4');
--Testcase 60:
SELECT (a = b) as true FROM INT4_TMP;
 true 
------
 t
(1 row)

--Testcase 61:
DELETE FROM INT4_TMP;
--Testcase 62:
INSERT INTO INT4_TMP(a, b) VALUES (int2 '2' * int4 '2', int4 '16' / int2 '4');
--Testcase 63:
SELECT (a = b) as true FROM INT4_TMP;
 true 
------
 t
(1 row)

--Testcase 64:
DELETE FROM INT4_TMP;
--Testcase 65:
INSERT INTO INT4_TMP(a, b) VALUES (int4 '1000', int4 '999');
--Testcase 66:
SELECT (a < b) as false FROM INT4_TMP;
 false 
-------
 f
(1 row)

--Testcase 73:
DELETE FROM INT4_TBL;
--Testcase 74:
INSERT INTO INT4_TBL(f1) VALUES (1 + 1 + 1 + 1 + 1 + 1 + 1 + 1 + 1 + 1);
--Testcase 75:
SELECT f1 as ten FROM INT4_TBL;
 ten 
-----
  10
(1 row)

--Testcase 76:
DELETE FROM INT4_TBL;
--Testcase 77:
INSERT INTO INT4_TBL(f1) VALUES (2 + 2 / 2);
--Testcase 78:
SELECT f1 as three FROM INT4_TBL;
 three 
-------
     3
(1 row)

--Testcase 79:
DELETE FROM INT4_TBL;
--Testcase 80:
INSERT INTO INT4_TBL(f1) VALUES ((2 + 2) / 2);
--Testcase 81:
SELECT f1 as two FROM INT4_TBL;
 two 
-----
   2
(1 row)

-- corner case
--Testcase 82:
DELETE FROM INT4_TBL;
--Testcase 83:
INSERT INTO INT4_TBL(f1) VALUES ((-1::int4<<31));
--Testcase 116:
SELECT f1::text AS text FROM INT4_TBL;
    text     
-------------
 -2147483648
(1 row)

--Testcase 84:
--Testcase 85:
SELECT (f1+1)::text FROM INT4_TBL;
    text     
-------------
 -2147483647
(1 row)

-- check sane handling of INT_MIN overflow cases
--Testcase 86:
DELETE FROM INT4_TBL;
--Testcase 87:
INSERT INTO INT4_TBL(f1) VALUES ((-2147483648)::int4);
--Testcase 88:
SELECT (f1 * (-1)::int4) FROM INT4_TBL;
psql:sql/14.5/int4.sql:261: ERROR:  integer out of range
--Testcase 89:
DELETE FROM INT4_TBL;
--Testcase 90:
INSERT INTO INT4_TBL(f1) VALUES ((-2147483648)::int4);
--Testcase 91:
SELECT (f1 / (-1)::int4) FROM INT4_TBL;
psql:sql/14.5/int4.sql:269: ERROR:  integer out of range
--Testcase 92:
DELETE FROM INT4_TBL;
--Testcase 93:
INSERT INTO INT4_TBL(f1) VALUES ((-2147483648)::int4);
--Testcase 94:
SELECT (f1 % (-1)::int4) FROM INT4_TBL;
 ?column? 
----------
        0
(1 row)

--Testcase 95:
DELETE FROM INT4_TBL;
--Testcase 96:
INSERT INTO INT4_TBL(f1) VALUES ((-2147483648)::int4);
--Testcase 97:
SELECT (f1 * (-1)::int2) FROM INT4_TBL;
psql:sql/14.5/int4.sql:285: ERROR:  integer out of range
--Testcase 98:
DELETE FROM INT4_TBL;
--Testcase 99:
INSERT INTO INT4_TBL(f1) VALUES ((-2147483648)::int4);
--Testcase 100:
SELECT (f1 / (-1)::int2) FROM INT4_TBL;
psql:sql/14.5/int4.sql:293: ERROR:  integer out of range
--Testcase 101:
DELETE FROM INT4_TBL;
--Testcase 102:
INSERT INTO INT4_TBL(f1) VALUES ((-2147483648)::int4);
--Testcase 103:
SELECT (f1 % (-1)::int2) FROM INT4_TBL;
 ?column? 
----------
        0
(1 row)

-- check rounding when casting from float
--Testcase 117:
CREATE FOREIGN TABLE FLOAT8_TBL(id serial OPTIONS (key 'true'), f1 float8) SERVER :DB_SERVERNAME OPTIONS (table_name 'float8_tbl'); 
--Testcase 104:
DELETE FROM FLOAT8_TBL;
--Testcase 105:
INSERT INTO FLOAT8_TBL(f1) VALUES 
	(-2.5::float8),
        (-1.5::float8),
        (-0.5::float8),
        (0.0::float8),
        (0.5::float8),
        (1.5::float8),
        (2.5::float8);
--Testcase 106:
SELECT f1 as x, f1::int4 AS int4_value FROM FLOAT8_TBL;
  x   | int4_value 
------+------------
 -2.5 |         -2
 -1.5 |         -2
 -0.5 |          0
    0 |          0
  0.5 |          0
  1.5 |          2
  2.5 |          2
(7 rows)

-- check rounding when casting from numeric
--Testcase 107:
DELETE FROM FLOAT8_TBL;
--Testcase 108:
INSERT INTO FLOAT8_TBL(f1) VALUES 
	(-2.5::numeric),
        (-1.5::numeric),
        (-0.5::numeric),
        (0.0::numeric),
        (0.5::numeric),
        (1.5::numeric),
        (2.5::numeric);
--Testcase 109:
SELECT f1::numeric as x, f1::numeric::int4 AS int4_value FROM FLOAT8_TBL;
  x   | int4_value 
------+------------
 -2.5 |         -3
 -1.5 |         -2
 -0.5 |         -1
    0 |          0
  0.5 |          1
  1.5 |          2
  2.5 |          3
(7 rows)

-- test gcd()
--Testcase 118:
DELETE FROM INT4_TMP;
--Testcase 119:
INSERT INTO INT4_TMP(a, b) VALUES (0::int4, 0::int4);
--Testcase 120:
INSERT INTO INT4_TMP(a, b) VALUES (0::int4, 6410818::int4);
--Testcase 121:
INSERT INTO INT4_TMP(a, b) VALUES (61866666::int4, 6410818::int4);
--Testcase 122:
INSERT INTO INT4_TMP(a, b) VALUES (-61866666::int4, 6410818::int4);
--Testcase 123:
INSERT INTO INT4_TMP(a, b) VALUES ((-2147483648)::int4, 1::int4);
--Testcase 124:
INSERT INTO INT4_TMP(a, b) VALUES ((-2147483648)::int4, 2147483647::int4);
--Testcase 125:
INSERT INTO INT4_TMP(a, b) VALUES ((-2147483648)::int4, 1073741824::int4);
--Testcase 126:
SELECT a, b, gcd(a, b), gcd(a, -b), gcd(b, a), gcd(-b, a) FROM INT4_TMP;
      a      |     b      |    gcd     |    gcd     |    gcd     |    gcd     
-------------+------------+------------+------------+------------+------------
           0 |          0 |          0 |          0 |          0 |          0
           0 |    6410818 |    6410818 |    6410818 |    6410818 |    6410818
    61866666 |    6410818 |       1466 |       1466 |       1466 |       1466
   -61866666 |    6410818 |       1466 |       1466 |       1466 |       1466
 -2147483648 |          1 |          1 |          1 |          1 |          1
 -2147483648 | 2147483647 |          1 |          1 |          1 |          1
 -2147483648 | 1073741824 | 1073741824 | 1073741824 | 1073741824 | 1073741824
(7 rows)

--Testcase 127:
DELETE FROM INT4_TMP;
--Testcase 128:
INSERT INTO INT4_TMP(a, b) VALUES ((-2147483648)::int4, 0::int4);
--Testcase 129:
SELECT gcd(a, b) FROM INT4_TMP;    -- overflow
psql:sql/14.5/int4.sql:368: ERROR:  integer out of range
--Testcase 130:
DELETE FROM INT4_TMP;
--Testcase 131:
INSERT INTO INT4_TMP(a, b) VALUES ((-2147483648)::int4, (-2147483648)::int4);
--Testcase 132:
SELECT gcd(a, b) FROM INT4_TMP;    -- overflow
psql:sql/14.5/int4.sql:377: ERROR:  integer out of range
-- test lcm()
--Testcase 133:
DELETE FROM INT4_TMP;
--Testcase 134:
INSERT INTO INT4_TMP(a, b) VALUES (0::int4, 0::int4);
--Testcase 135:
INSERT INTO INT4_TMP(a, b) VALUES (0::int4, 42::int4);
--Testcase 136:
INSERT INTO INT4_TMP(a, b) VALUES (42::int4, 42::int4);
--Testcase 137:
INSERT INTO INT4_TMP(a, b) VALUES (330::int4, 462::int4);
--Testcase 138:
INSERT INTO INT4_TMP(a, b) VALUES (-330::int4, 462::int4);
--Testcase 139:
INSERT INTO INT4_TMP(a, b) VALUES ((-2147483648)::int4, 0::int4);
--Testcase 140:
SELECT a, b, lcm(a, b), lcm(a, -b), lcm(b, a), lcm(-b, a) FROM INT4_TMP;
      a      |  b  | lcm  | lcm  | lcm  | lcm  
-------------+-----+------+------+------+------
           0 |   0 |    0 |    0 |    0 |    0
           0 |  42 |    0 |    0 |    0 |    0
          42 |  42 |   42 |   42 |   42 |   42
         330 | 462 | 2310 | 2310 | 2310 | 2310
        -330 | 462 | 2310 | 2310 | 2310 | 2310
 -2147483648 |   0 |    0 |    0 |    0 |    0
(6 rows)

--Testcase 141:
DELETE FROM INT4_TMP;
--Testcase 142:
INSERT INTO INT4_TMP(a, b) VALUES ((-2147483648)::int4, 1::int4);
--Testcase 143:
SELECT lcm(a, b) FROM INT4_TMP;    -- overflow
psql:sql/14.5/int4.sql:406: ERROR:  integer out of range
--Testcase 144:
DELETE FROM INT4_TMP;
--Testcase 145:
INSERT INTO INT4_TMP(a, b) VALUES (2147483647::int4, 2147483646::int4);
--Testcase 146:
SELECT lcm(a, b) FROM INT4_TMP;    -- overflow
psql:sql/14.5/int4.sql:415: ERROR:  integer out of range
DELETE FROM INT4_TBL;
DELETE FROM INT4_TMP;
DELETE FROM FLOAT8_TBL;
--Testcase 147:
DROP FOREIGN TABLE INT4_TMP;
--Testcase 148:
DROP FOREIGN TABLE INT4_TBL;
--Testcase 149:
DROP FOREIGN TABLE FLOAT8_TBL;
--Testcase 150:
DROP USER MAPPING FOR public SERVER :DB_SERVERNAME;
--Testcase 151:
DROP SERVER :DB_SERVERNAME;
--Testcase 152:
DROP EXTENSION :DB_EXTENSIONNAME CASCADE;
